{
  "schema_version": 2,
  "session": {
    "id": "01a0c915-a92e-7ae2-a6ad-737746c47d43",
    "source_path": "/home/robertvanvossen/.codex/sessions/2026/09/22/rollout-2026-09-22T08-27-15-01a0c915-a92e-7ae2-a6ad-737746c47d43.jsonl",
    "source_type": "codex-rollout-jsonl",
    "cwd": "/home/robertvanvossen/dev/agentic-hamr-experiments-02/mavlink_02",
    "git_branch": "main"
  },
  "harness": {
    "name": "codex",
    "version": "0.154.0",
    "adapter_version": "2.0.0",
    "source_format_version": "codex-rollout-jsonl-v2"
  },
  "scope": {
    "primary_development_session_only": true,
    "subagent_activity": "excluded",
    "note": "Subagents are excluded until both harness adapters can include them consistently."
  },
  "span": {
    "first": "2026-09-22T12:27:27.431000+00:00",
    "last": "2026-09-24T01:19:11.568000+00:00",
    "wall_clock_seconds": 132704,
    "active_seconds": 18143,
    "active_gap_seconds": 300
  },
  "models": {
    "gpt-6-astra": {
      "input": 2345891,
      "output": 295554,
      "cache_read": 82935168,
      "cache_write": 0,
      "reasoning_output": 35002
    }
  },
  "counts": {
    "user_turns": 97,
    "assistant_messages": 249,
    "tool_calls": 527,
    "tool_results": 526,
    "malformed_records": 0,
    "compactions": 0
  },
  "cost_usd": {
    "api_list_price_equivalent": {
      "total": null,
      "by_model": {
        "gpt-6-astra": null
      }
    },
    "actual": null,
    "billing_basis": null,
    "pricing_date": "2026-08-03",
    "note": "API list-price equivalence is the cross-run comparison measure. Actual billing remains null unless a transcript supplies a trustworthy billed amount; subscription credits and rate-limit percentages are not converted to dollars."
  },
  "friction": {
    "escalation_requests": [],
    "dynamic_shell_commands": [],
    "sandbox_failures": [],
    "observed_policy_settings": [
      {
        "approval_policy": "on-request",
        "sandbox_policy": {
          "type": "workspace-write",
          "writable_roots": [
            "/home/robertvanvossen/tools/hamr-agent-context"
          ],
          "network_access": false,
          "exclude_tmpdir_env_var": false,
          "exclude_slash_tmp": false
        },
        "collaboration_mode": "default"
      }
    ],
    "observable_approval_outcomes": [
      {
        "call_id": null,
        "outcome": "approval_granted",
        "evidence": "Approved command prefix saved:\n- [\"/usr/bin/zsh\", \"-lc\", \"RUSTC_BOOTSTRAP=1 CARGO_INCREMENTAL=0 RUSTFLAGS='-Cinstrument-coverage' LLVM_PROFILE_FILE='target/coverage/cargo-test-%p-%m.profraw' cargo tes  …[+3 chars]"
      }
    ],
    "parser_coverage_warnings": [
      "call_ovgBS7O6pZwc9xM1IxtVDVSX: tools.exec_command arguments were not a JSON literal",
      "call_ovgBS7O6pZwc9xM1IxtVDVSX: tools.exec_command arguments were not a JSON literal",
      "custom orchestration call call_ovgBS7O6pZwc9xM1IxtVDVSX could not be decoded; nested shell coverage is incomplete",
      "call_I3B4uzasVXmMRk2mvO3UFjOf: tools.exec_command arguments were not a JSON literal",
      "custom orchestration call call_I3B4uzasVXmMRk2mvO3UFjOf could not be decoded; nested shell coverage is incomplete",
      "call_4TKbJ5ayabcSU6B4swWLR8hY: tools.exec_command arguments were not a JSON literal",
      "custom orchestration call call_4TKbJ5ayabcSU6B4swWLR8hY could not be decoded; nested shell coverage is incomplete",
      "call_Fgt92NdBoZDONqDciuFvc6VQ: tools.exec_command arguments were not a JSON literal",
      "custom orchestration call call_Fgt92NdBoZDONqDciuFvc6VQ could not be decoded; nested shell coverage is incomplete",
      "call_jNL4ORm3y5vXm0zPhUw6axvI: tools.exec_command arguments were not a JSON literal",
      "custom orchestration call call_jNL4ORm3y5vXm0zPhUw6axvI could not be decoded; nested shell coverage is incomplete",
      "call_bucV0d9pcDt5qKbAIiVRK5lp: tools.exec_command arguments were not a JSON literal",
      "custom orchestration call call_bucV0d9pcDt5qKbAIiVRK5lp could not be decoded; nested shell coverage is incomplete",
      "call_cQZE4veWSrLNkPPw8ZFPjLiA: tools.exec_command arguments were not a JSON literal",
      "custom orchestration call call_cQZE4veWSrLNkPPw8ZFPjLiA could not be decoded; nested shell coverage is incomplete",
      "call_tAGt1zReAvVAhGARo2x5uAUx: tools.exec_command arguments were not a JSON literal",
      "custom orchestration call call_tAGt1zReAvVAhGARo2x5uAUx could not be decoded; nested shell coverage is incomplete",
      "call_oJROHE053g6zsZKBQFJmE7Vg: tools.exec_command arguments were not a JSON literal",
      "custom orchestration call call_oJROHE053g6zsZKBQFJmE7Vg could not be decoded; nested shell coverage is incomplete",
      "call_4RLUtRahfj7O1mrU0qSPGHfw: tools.exec_command arguments were not a JSON literal",
      "custom orchestration call call_4RLUtRahfj7O1mrU0qSPGHfw could not be decoded; nested shell coverage is incomplete",
      "call_uoajpznhfGmuITSlo9CGNGB0: tools.exec_command arguments were not a JSON literal",
      "call_uoajpznhfGmuITSlo9CGNGB0: tools.exec_command arguments were not a JSON literal",
      "custom orchestration call call_uoajpznhfGmuITSlo9CGNGB0 could not be decoded; nested shell coverage is incomplete",
      "call_tMM5RsmF8MPwR7x8mRxdT3u8: tools.exec_command arguments were not a JSON literal",
      "custom orchestration call call_tMM5RsmF8MPwR7x8mRxdT3u8 could not be decoded; nested shell coverage is incomplete",
      "call_Cuy58gijWd6iYcGaCcSDKywL: tools.exec_command arguments were not a JSON literal",
      "custom orchestration call call_Cuy58gijWd6iYcGaCcSDKywL could not be decoded; nested shell coverage is incomplete",
      "call_OSxPr7l0sL3Uz3tniibk5gCl: tools.exec_command arguments were not a JSON literal",
      "call_OSxPr7l0sL3Uz3tniibk5gCl: tools.exec_command arguments were not a JSON literal",
      "custom orchestration call call_OSxPr7l0sL3Uz3tniibk5gCl could not be decoded; nested shell coverage is incomplete",
      "call_p0ftR9Uz31XLDl35kzUr6AKn: tools.exec_command arguments were not a JSON literal",
      "call_p0ftR9Uz31XLDl35kzUr6AKn: tools.exec_command arguments were not a JSON literal",
      "call_p0ftR9Uz31XLDl35kzUr6AKn: tools.exec_command arguments were not a JSON literal",
      "call_p0ftR9Uz31XLDl35kzUr6AKn: tools.exec_command arguments were not a JSON literal",
      "custom orchestration call call_p0ftR9Uz31XLDl35kzUr6AKn could not be decoded; nested shell coverage is incomplete",
      "call_S56Jz7bts1DdQ02AlMylP8zU: tools.exec_command arguments were not a JSON literal",
      "call_S56Jz7bts1DdQ02AlMylP8zU: tools.exec_command arguments were not a JSON literal",
      "call_S56Jz7bts1DdQ02AlMylP8zU: tools.exec_command arguments were not a JSON literal",
      "call_S56Jz7bts1DdQ02AlMylP8zU: tools.exec_command arguments were not a JSON literal",
      "custom orchestration call call_S56Jz7bts1DdQ02AlMylP8zU could not be decoded; nested shell coverage is incomplete",
      "call_RUfSNUda8Tx11fj9wWhDBwhb: tools.exec_command arguments were not a JSON literal",
      "call_RUfSNUda8Tx11fj9wWhDBwhb: tools.exec_command arguments were not a JSON literal",
      "custom orchestration call call_RUfSNUda8Tx11fj9wWhDBwhb could not be decoded; nested shell coverage is incomplete",
      "call_9nKxjnMK21m3BAy554QBoTHn: tools.exec_command arguments were not a JSON literal",
      "call_9nKxjnMK21m3BAy554QBoTHn: tools.exec_command arguments were not a JSON literal",
      "custom orchestration call call_9nKxjnMK21m3BAy554QBoTHn could not be decoded; nested shell coverage is incomplete",
      "call_0PeO3wr5Rn9O9urDE77m8XpJ: tools.exec_command arguments were not a JSON literal",
      "call_0PeO3wr5Rn9O9urDE77m8XpJ: tools.exec_command arguments were not a JSON literal",
      "custom orchestration call call_0PeO3wr5Rn9O9urDE77m8XpJ could not be decoded; nested shell coverage is incomplete",
      "call_nvBa8rdlPp7yM8VxNfdL9VPH: tools.exec_command arguments were not a JSON literal",
      "call_nvBa8rdlPp7yM8VxNfdL9VPH: tools.exec_command arguments were not a JSON literal",
      "call_nvBa8rdlPp7yM8VxNfdL9VPH: tools.exec_command arguments were not a JSON literal",
      "call_nvBa8rdlPp7yM8VxNfdL9VPH: tools.exec_command arguments were not a JSON literal",
      "custom orchestration call call_nvBa8rdlPp7yM8VxNfdL9VPH could not be decoded; nested shell coverage is incomplete",
      "call_SCOidqyy9Sn2ZOdCwFc9XSBv: tools.exec_command arguments were not a JSON literal",
      "call_SCOidqyy9Sn2ZOdCwFc9XSBv: tools.exec_command arguments were not a JSON literal",
      "custom orchestration call call_SCOidqyy9Sn2ZOdCwFc9XSBv could not be decoded; nested shell coverage is incomplete",
      "call_TnemETlOqM8B9rAGhUQPJLb5: tools.exec_command arguments were not a JSON literal",
      "call_TnemETlOqM8B9rAGhUQPJLb5: tools.exec_command arguments were not a JSON literal",
      "custom orchestration call call_TnemETlOqM8B9rAGhUQPJLb5 could not be decoded; nested shell coverage is incomplete",
      "call_eRMcvNgXnMYBIo3vPj6ksJt0: tools.exec_command arguments were not a JSON literal",
      "call_eRMcvNgXnMYBIo3vPj6ksJt0: tools.exec_command arguments were not a JSON literal",
      "call_eRMcvNgXnMYBIo3vPj6ksJt0: tools.exec_command arguments were not a JSON literal",
      "custom orchestration call call_eRMcvNgXnMYBIo3vPj6ksJt0 could not be decoded; nested shell coverage is incomplete",
      "call_WOOSZylzRHXGg3ugWb6iciy5: tools.exec_command arguments were not a JSON literal",
      "custom orchestration call call_WOOSZylzRHXGg3ugWb6iciy5 could not be decoded; nested shell coverage is incomplete",
      "call_Rx7FYUf8xEjcHOtgpSGhIhJj: tools.exec_command arguments were not a JSON literal",
      "call_Rx7FYUf8xEjcHOtgpSGhIhJj: tools.exec_command arguments were not a JSON literal",
      "call_Rx7FYUf8xEjcHOtgpSGhIhJj: tools.exec_command arguments were not a JSON literal",